{
  "kind": "fl-sap-order",
  "version": 1,
  "orderGuid": "6f1c2a9e-4b7d-4e2a-9c1f-2d8e5a3b7c40",
  "createdOn": "2026-10-03T08:15:00Z",
  "environment": "DEV",
  "site": "https://orsted.sharepoint.com/teams/BioSAPDev",
  "request": {
    "spId": 12,
    "requestNo": "FL-000012",
    "requestGuid": "0b5e7c3a-1d2f-4a6b-8c9d-7e1f2a3b4c5d",
    "status": "Indsendt",
    "requesterName": "Rekvirent Eksempel",
    "requesterEmail": "rekvirent@example.com",
    "submittedOn": "2026-10-03T08:12:41Z"
  },
  "rows": [
    {
      "spId": 101,
      "rowGuid": "1a2b3c4d-0000-4000-8000-000000000101",
      "rowNo": 1,
      "functionalLocation": "SSV10 LAC10AB001 -B01",
      "description": "Tryktransmitter",
      "strIndicator": "KKS",
      "assignedClass": "GIV",
      "rowStatus": "valid",
      "firstIssue": "",
      "values": [
        { "field": "ABC INDIC.", "value": "A" },
        { "field": "EX-MARKING", "value": "Ex d" },
        { "field": "GIV_EXT ASSIGNMENT", "value": "X" },
        { "field": "LONG TEXT", "value": "Tryktransmitter" },
        { "field": "MANUFACTURER", "value": "Endress+Hauser" },
        { "field": "MODEL NUMBER", "value": "PMP71" },
        { "field": "OPERATING PRESSURE", "value": "16" },
        { "field": "OPERATING PRESSURE UOM", "value": "Bar" },
        { "field": "OPERATING TEMPERATURE", "value": "120" },
        { "field": "OPERATING TEMPERATURE UOM", "value": "°C" },
        { "field": "OWNER", "value": "Energinet" },
        { "field": "ROOM", "value": "K-012" },
        { "field": "SAFETY CRITICAL EQUIPMENT", "value": "3.1 TRIP-kedelbeskyttelse|4.1 Sikker forsyning" },
        { "field": "TRM ASSIGNMENT", "value": "X" },
        { "field": "WARRANTY END", "value": "20281231" },
        { "field": "WARRANTY START", "value": "01.01.2026" }
      ]
    },
    {
      "spId": 102,
      "rowGuid": "1a2b3c4d-0000-4000-8000-000000000102",
      "rowNo": 2,
      "functionalLocation": "SSV10 LAC10AP001 -M01",
      "description": "Pumpemotor",
      "strIndicator": "KKS",
      "assignedClass": "ELF",
      "rowStatus": "warning",
      "firstIssue": "Supply from: check the cabinet name.",
      "values": [
        { "field": "ATEX", "value": "X" },
        { "field": "POWER [KW]", "value": "15" },
        { "field": "PTW", "value": "X" },
        { "field": "REMARKS", "value": "Frekvensomformer|Se tavle 3" },
        { "field": "SUPPLY FROM", "value": "SSV10 BFA01" },
        { "field": "SWITCHING LOCATION", "value": "Kontrolrum" },
        { "field": "VOLTAGE [V]", "value": "400" }
      ]
    },
    {
      "spId": 103,
      "rowGuid": "1a2b3c4d-0000-4000-8000-000000000103",
      "rowNo": 3,
      "functionalLocation": "SSV10 BFA01GH001 -W01",
      "description": "Kabel til pumpemotor",
      "strIndicator": "KKS",
      "assignedClass": "KAB",
      "rowStatus": "valid",
      "firstIssue": "",
      "values": [
        { "field": "CABLE TYPE", "value": "NOIKLX" },
        { "field": "DIMENSION", "value": "4x16" },
        { "field": "FROM FUNCTIONAL LOCATION", "value": "SSV10 BFA01" },
        { "field": "SUPERIOR FL", "value": "SSV10 BFA01" },
        { "field": "TO FUNCTIONAL LOCATION", "value": "SSV10 LAC10AP001 -M01" },
        { "field": "VOLTAGE [V]", "value": "400" }
      ]
    }
  ]
}
